{
  "id": "kk-4day",
  "name": "nSuns 4days+",
  "description": "## 핵심 구조 (2주 사이클 · 주 5일 · 과학 패널 검증 2026-07-11)\n- 월 등(티바 6~9렙 이중진행·풀업·후면어깨) / 화 데드(1주차 볼륨↔2주차 헤비 교차) / 수 OHP T1+벤치 볼륨 / 금 스쿼트+스모 / 토 벤치+CGBP. 일요일 크로스핏은 홈의 자유 운동 기록으로.\n## 증량\n- T1 탑세트(95%×1+) 반복수 판정: 0~1 동결·제안 / 2~3 자동(+2.5 상체·+5 하체) / 4+ 추가 제안. 데드는 헤비 주(2주 1회)만 판정 = +5kg/2주.\n- T2(프론트+5·스모/CGBP+2.5): 첫 세트는 가벼운 스타터, 이후 동일무게 워크세트 — 마지막 워크세트 완수 시 증량.\n- 등 메인(티바): 마지막 세트 9렙 도달 시 +5kg 후 6렙부터 다시.\n## 설계 근거 (평가 반영)\n- T1 6세트(램프→탑세트→80% 고정 백오프): 검증된 MAX+백오프 프로토콜 정합, 원판 교체 최소화. 하체는 백오프 AMRAP 제거(축성 피로), 상체만 마지막 AMRAP 유지.\n- 세트 내 반복수 언듈레이팅 제거: 세션 내 rep 파동을 지지하는 근거 부재 — 고정 rep이 동등.\n- 후면어깨 3세트 신설(프레스:풀 균형), 힙쓰러스트 2세트·스모 4세트로 감축(햄·둔 주간 부하 초과 교정).\n## ⚠️ 급성 허리부상 운용 (첫 2~3주)\n- 시작 전 하지 방사통·저림·마비 있으면 훈련 보류, 의료 상담 먼저.\n- 화·금: 데드·스쿼트에 통증일(경량) 프리셋 또는 TM 10~15% 임시 하향 — 95% 탑세트를 실질 82~85%로. 스모는 세트 축소/스킵.\n- 월·수 행잉 레그레이즈(굴곡)·백익스텐션은 통증 있으면 스킵.\n- 매 세션 통증 ≤3/10 & 다음날 원상복귀 확인 후 다음 세션 진행. 2주 연속 무통 후 데드 헤비 주 최초 도입.\n\n## 메조사이클 (v2, 과학 패널 2차 검증 2026-07-12)\n- 전체 = 7주 반복: (볼륨+헤비) 2주 × 3회 = 누적 6주 → 7주차 디로드.\n- 근거: 디로드 간격 수렴 구간 4~8주(현장 설문 평균 5.6±2.3주 · RP 4~6주 · Wendler 3+1) — 6주 누적은 그 상단. 블록 주기화(축적→강화→실현)는 중급자에게 시기상조(메타분석은 '변화>무변화'만 입증, 주 단위 파동이 이미 DUP형).\n- 디로드 주: 볼륨 -50~60%(T1·T2 각 3세트), 강도 -10%p 이상(T1 60%·데드 55%·T2 -10%p), AMRAP·증량 규칙 전부 제거. 완전 휴식형은 금지(근력 손실 근거) — 가벼운 부하 유지형. 등날 tracked 무게는 표시값보다 가볍게 RIR 3~4. 일요일 크로스핏도 저강도로.\n## TM 재조정 규칙 (재검사 금지 — AMRAP 오토레귤레이션 신뢰)\n- 탑세트 정상 반복 → 표준 증량(+2.5 상체/+5 하체) 그대로.\n- 탑세트 8회 이상 = TM이 보수적 → e1RM(엡리) × 85~90%로 TM 재산정 (히스토리 탭 e1RM 차트 참조).\n- 탑세트가 2사이클(4주) 이상 정체·하락 → TM −10% 리셋.\n## 부상 복귀 중 운용 (현재)\n- 새 7주를 처음부터 시작하지 말고, **이번 주를 7주차(디로드)로 설정**(프로그램 탭 → 진행 위치) → 다음 주 1주차부터 정상 사이클.\n- 누적 주 데드 탑세트는 당분간 RIR 2~3에서 캡(실패 금지), 통증 재발 시 세트 축소 또는 트랩바·블록풀 대체. 완전 최대부하 복귀는 부상 후 8~16주 프레임.",
  "version": 2,
  "schemaVersion": 1,
  "weeks": [
    {
      "days": [
        {
          "ordinal": 1,
          "weekdayHint": "월",
          "name": "등 — 티바·풀업",
          "slots": [
            {
              "id": "d1-tbar",
              "exerciseId": "tbarRow",
              "label": "메인",
              "sets": [
                {
                  "load": {
                    "kind": "tracked"
                  },
                  "reps": 6
                },
                {
                  "load": {
                    "kind": "tracked"
                  },
                  "reps": 6
                },
                {
                  "load": {
                    "kind": "tracked"
                  },
                  "reps": 6
                },
                {
                  "load": {
                    "kind": "tracked"
                  },
                  "reps": 6
                }
              ],
              "progressionRuleId": "doubleProgression",
              "progressionParams": {
                "repMin": 6,
                "repMax": 9,
                "weightStep": 5,
                "sets": 4
              },
              "defaultLoad": {
                "ref": "deadlift",
                "pct": 0.55
              }
            },
            {
              "id": "d1-pullup",
              "exerciseId": "pullup",
              "label": "보조풀",
              "sets": [
                {
                  "load": {
                    "kind": "tracked"
                  },
                  "reps": 6
                },
                {
                  "load": {
                    "kind": "tracked"
                  },
                  "reps": 6
                },
                {
                  "load": {
                    "kind": "tracked"
                  },
                  "reps": 6
                },
                {
                  "load": {
                    "kind": "tracked"
                  },
                  "reps": 6
                }
              ],
              "progressionRuleId": "doubleProgression",
              "progressionParams": {
                "repMin": 6,
                "repMax": 10,
                "weightStep": 2.5,
                "sets": 4
              },
              "defaultLoad": {
                "kg": 5
              }
            },
            {
              "id": "d1-backext",
              "exerciseId": "backExtension",
              "label": "accessory",
              "sets": [
                {
                  "load": {
                    "kind": "tracked"
                  },
                  "reps": 10
                },
                {
                  "load": {
                    "kind": "tracked"
                  },
                  "reps": 10
                },
                {
                  "load": {
                    "kind": "tracked"
                  },
                  "reps": 10
                }
              ],
              "progressionRuleId": "doubleProgression",
              "progressionParams": {
                "repMin": 10,
                "repMax": 15,
                "weightStep": 5,
                "sets": 3
              },
              "defaultLoad": {
                "kg": 10
              }
            },
            {
              "id": "d1-reardelt",
              "exerciseId": "rearDeltFly",
              "label": "accessory",
              "sets": [
                {
                  "load": {
                    "kind": "tracked"
                  },
                  "reps": 12
                },
                {
                  "load": {
                    "kind": "tracked"
                  },
                  "reps": 12
                },
                {
                  "load": {
                    "kind": "tracked"
                  },
                  "reps": 12
                }
              ],
              "progressionRuleId": "doubleProgression",
              "progressionParams": {
                "repMin": 12,
                "repMax": 20,
                "weightStep": 2.5,
                "sets": 3
              },
              "defaultLoad": {
                "ref": "ohp",
                "pct": 0.12
              }
            },
            {
              "id": "d1-abs",
              "exerciseId": "legRaise",
              "label": "accessory",
              "sets": [
                {
                  "load": {
                    "kind": "tracked"
                  },
                  "reps": 10
                },
                {
                  "load": {
                    "kind": "tracked"
                  },
                  "reps": 10
                },
                {
                  "load": {
                    "kind": "tracked"
                  },
                  "reps": 10
                }
              ],
              "progressionRuleId": "doubleProgression",
              "progressionParams": {
                "repMin": 10,
                "repMax": 15,
                "weightStep": 2.5,
                "sets": 3
              },
              "defaultLoad": {
                "kg": 5
              }
            }
          ]
        },
        {
          "ordinal": 2,
          "weekdayHint": "화",
          "name": "데드 볼륨 + 프론트",
          "slots": [
            {
              "id": "d2-dead-vol",
              "exerciseId": "deadlift",
              "label": "T1",
              "sets": [
                {
                  "load": {
                    "kind": "pctOfTM",
                    "pct": 0.6
                  },
                  "reps": 5
                },
                {
                  "load": {
                    "kind": "pctOfTM",
                    "pct": 0.7
                  },
                  "reps": 5
                },
                {
                  "load": {
                    "kind": "pctOfTM",
                    "pct": 0.7
                  },
                  "reps": 5
                },
                {
                  "load": {
                    "kind": "pctOfTM",
                    "pct": 0.7
                  },
                  "reps": 5
                },
                {
                  "load": {
                    "kind": "pctOfTM",
                    "pct": 0.7
                  },
                  "reps": 5
                }
              ]
            },
            {
              "id": "d2-front",
              "exerciseId": "frontSquat",
              "label": "T2",
              "sets": [
                {
                  "load": {
                    "kind": "pctOfTM",
                    "pct": 0.5
                  },
                  "reps": 10
                },
                {
                  "load": {
                    "kind": "pctOfTM",
                    "pct": 0.6
                  },
                  "reps": 8
                },
                {
                  "load": {
                    "kind": "pctOfTM",
                    "pct": 0.6
                  },
                  "reps": 8
                },
                {
                  "load": {
                    "kind": "pctOfTM",
                    "pct": 0.6
                  },
                  "reps": 8
                },
                {
                  "load": {
                    "kind": "pctOfTM",
                    "pct": 0.6
                  },
                  "reps": 8
                }
              ],
              "progressionRuleId": "t2LastSet",
              "progressionParams": {
                "increment": 5
              }
            },
            {
              "id": "d2-hip",
              "exerciseId": "hipThrust",
              "label": "accessory",
              "sets": [
                {
                  "load": {
                    "kind": "tracked"
                  },
                  "reps": 8
                },
                {
                  "load": {
                    "kind": "tracked"
                  },
                  "reps": 8
                }
              ],
              "progressionRuleId": "doubleProgression",